{
  "boundary": "env-prod",
  "config_digest": "da7b24cbeaa43ad07f29d9d636909116430563fa283438236e9180ea6a65d912",
  "id": "module.compute.function.ingest",
  "name": "ingest-function",
  "native_type": "Function",
  "provider": "generic",
  "region": "region-1",
  "resource_type": "serverless_fn",
  "tags": {
    "env": "prod",
    "source": "terraform-state",
    "team": "platform"
  }
}
